{
  "publication_id": "2-s2.0-84883725740",
  "eid": "2-s2.0-84883725740",
  "doi": null,
  "pii": null,
  "pubmed_id": null,
  "title": "Near-field wavepackets and the far-field sound of a subsonic jet",
  "year": "2013",
  "date": "2013-09-16",
  "type": "article",
  "subtype": "cp",
  "journal": {
    "name": "19th AIAA Ceas Aeroacoustics Conference",
    "issn": null,
    "eissn": null,
    "volume": null,
    "issue": null,
    "pages": "81",
    "article_number": null
  },
  "authors": [
    {
      "name": "Breakey, David E.S.",
      "scopus_id": "55638088500",
      "affiliation": null,
      "is_eam_professor": false,
      "eam_professor_id": null
    },
    {
      "name": "Jordan, Peter",
      "scopus_id": "24759157900",
      "affiliation": null,
      "is_eam_professor": false,
      "eam_professor_id": null
    },
    {
      "name": "Cavalieri, André V.G.",
      "scopus_id": "22949935300",
      "affiliation": null,
      "is_eam_professor": true,
      "eam_professor_id": "andre-v-g-cavalieri"
    },
    {
      "name": "Léon, Olivier",
      "scopus_id": "55837629300",
      "affiliation": null,
      "is_eam_professor": false,
      "eam_professor_id": null
    },
    {
      "name": "Zhang, Mengqi",
      "scopus_id": "57205493993",
      "affiliation": null,
      "is_eam_professor": false,
      "eam_professor_id": null
    },
    {
      "name": "Lehnasch, Guillaume",
      "scopus_id": "24069278400",
      "affiliation": null,
      "is_eam_professor": false,
      "eam_professor_id": null
    },
    {
      "name": "Colonius, Tim",
      "scopus_id": "7004086046",
      "affiliation": null,
      "is_eam_professor": false,
      "eam_professor_id": null
    },
    {
      "name": "Rodríguez, Daniel",
      "scopus_id": "55255594800",
      "affiliation": null,
      "is_eam_professor": false,
      "eam_professor_id": null
    }
  ],
  "eam_coauthors": [
    "andre-v-g-cavalieri"
  ],
  "scopus": {
    "citations": 46,
    "references_count": 26,
    "scopus_link": "https://www.scopus.com/inward/record.uri?partnerID=HzOxMe3b&scp=84883725740&origin=inward"
  },
  "metadata": {
    "source": "scopus",
    "last_updated": "2026-05-06T15:53:47.102026",
    "data_quality_score": 70
  }
}
