{
  "publication_id": "2-s2.0-85111926899",
  "eid": "2-s2.0-85111926899",
  "doi": "10.1016/j.compscitech.2021.108962",
  "pii": "S0266353821003183",
  "pubmed_id": null,
  "title": "Mechanism based failure of 3D-printed continuous carbon fiber reinforced thermoplastic composites",
  "year": "2021",
  "date": "2021-09-08",
  "type": "article",
  "subtype": "ar",
  "journal": {
    "name": "Composites Science and Technology",
    "issn": "02663538",
    "eissn": null,
    "volume": "213",
    "issue": null,
    "pages": null,
    "article_number": "108962"
  },
  "authors": [
    {
      "name": "Dutra, Thiago Assis",
      "scopus_id": "57211220639",
      "affiliation": null,
      "is_eam_professor": false,
      "eam_professor_id": null
    },
    {
      "name": "Ferreira, Rafael Thiago Luiz",
      "scopus_id": "55690843400",
      "affiliation": null,
      "is_eam_professor": true,
      "eam_professor_id": "rafael-thiago-luiz-ferreira"
    },
    {
      "name": "Resende, Hugo Borelli",
      "scopus_id": "57196403328",
      "affiliation": null,
      "is_eam_professor": false,
      "eam_professor_id": null
    },
    {
      "name": "Blinzler, Brina Jane",
      "scopus_id": "36668249600",
      "affiliation": null,
      "is_eam_professor": false,
      "eam_professor_id": null
    },
    {
      "name": "Asp, Leif E.",
      "scopus_id": "7003735733",
      "affiliation": null,
      "is_eam_professor": false,
      "eam_professor_id": null
    }
  ],
  "eam_coauthors": [
    "rafael-thiago-luiz-ferreira"
  ],
  "scopus": {
    "citations": 18,
    "references_count": 71,
    "scopus_link": "https://www.scopus.com/inward/record.uri?partnerID=HzOxMe3b&scp=85111926899&origin=inward"
  },
  "metadata": {
    "source": "scopus",
    "last_updated": "2026-05-06T15:53:47.063715",
    "data_quality_score": 100
  }
}
