{
  "publication_id": "2-s2.0-85071419219",
  "eid": "2-s2.0-85071419219",
  "doi": "10.1007/s11046-019-00375-2",
  "pii": null,
  "pubmed_id": "31471824",
  "title": "Cold Atmospheric Pressure Plasma Jet Reduces Trichophyton rubrum Adherence and Infection Capacity",
  "year": "2019",
  "date": "2019-10-01",
  "type": "article",
  "subtype": "ar",
  "journal": {
    "name": "Mycopathologia",
    "issn": "0301486X",
    "eissn": "15730832",
    "volume": "184",
    "issue": "5",
    "pages": "585-595",
    "article_number": null
  },
  "authors": [
    {
      "name": "Borges, Aline Chiodi",
      "scopus_id": "57210799060",
      "affiliation": null,
      "is_eam_professor": false,
      "eam_professor_id": null
    },
    {
      "name": "Nishime, Thalita Mayumi Castaldelli",
      "scopus_id": "55305731200",
      "affiliation": null,
      "is_eam_professor": false,
      "eam_professor_id": null
    },
    {
      "name": "de Moura Rovetta, Sabrina",
      "scopus_id": "57210801943",
      "affiliation": null,
      "is_eam_professor": false,
      "eam_professor_id": null
    },
    {
      "name": "Lima, Gabriela de Morais Gouvêa",
      "scopus_id": "56457740900",
      "affiliation": null,
      "is_eam_professor": false,
      "eam_professor_id": null
    },
    {
      "name": "Kostov, Konstantin Georgiev",
      "scopus_id": "7005621302",
      "affiliation": null,
      "is_eam_professor": false,
      "eam_professor_id": null
    },
    {
      "name": "Thim, Gilmar Patrocínio",
      "scopus_id": "6602627592",
      "affiliation": null,
      "is_eam_professor": true,
      "eam_professor_id": "gilmar-patrocinio-thim"
    },
    {
      "name": "de Menezes, Beatriz Rossi Canuto",
      "scopus_id": "57188769777",
      "affiliation": null,
      "is_eam_professor": false,
      "eam_professor_id": null
    },
    {
      "name": "Machado, João Paulo Barros",
      "scopus_id": "35879983500",
      "affiliation": null,
      "is_eam_professor": false,
      "eam_professor_id": null
    },
    {
      "name": "Koga-Ito, Cristiane Yumi",
      "scopus_id": "6603358858",
      "affiliation": null,
      "is_eam_professor": false,
      "eam_professor_id": null
    }
  ],
  "eam_coauthors": [
    "gilmar-patrocinio-thim"
  ],
  "scopus": {
    "citations": 17,
    "references_count": 39,
    "scopus_link": "https://www.scopus.com/inward/record.uri?partnerID=HzOxMe3b&scp=85071419219&origin=inward"
  },
  "metadata": {
    "source": "scopus",
    "last_updated": "2026-05-06T15:53:47.105943",
    "data_quality_score": 100
  }
}
