{
  "publication_id": "2-s2.0-84880835496",
  "eid": "2-s2.0-84880835496",
  "doi": "10.2514/6.2013-1497",
  "pii": null,
  "pubmed_id": null,
  "title": "Modal-based damage detection of a composite helicopter main rotor blade",
  "year": "2013",
  "date": "2013-08-02",
  "type": "article",
  "subtype": "cp",
  "journal": {
    "name": "54th AIAA ASME ASCE AHS ASC Structures Structural Dynamics and Materials Conference",
    "issn": null,
    "eissn": null,
    "volume": null,
    "issue": null,
    "pages": null,
    "article_number": null
  },
  "authors": [
    {
      "name": "Marques dos Santos, Fàbio Luis",
      "scopus_id": "55212979900",
      "affiliation": null,
      "is_eam_professor": false,
      "eam_professor_id": null
    },
    {
      "name": "Peeters, Bart",
      "scopus_id": "7101854096",
      "affiliation": null,
      "is_eam_professor": false,
      "eam_professor_id": null
    },
    {
      "name": "van der Auweraer, Herman",
      "scopus_id": "7005384415",
      "affiliation": null,
      "is_eam_professor": false,
      "eam_professor_id": null
    },
    {
      "name": "Sandoval Góes, Luiz Carlos",
      "scopus_id": "8613267100",
      "affiliation": null,
      "is_eam_professor": true,
      "eam_professor_id": "luiz-carlos-sandoval-goes"
    }
  ],
  "eam_coauthors": [
    "luiz-carlos-sandoval-goes"
  ],
  "scopus": {
    "citations": 6,
    "references_count": 16,
    "scopus_link": "https://www.scopus.com/inward/record.uri?partnerID=HzOxMe3b&scp=84880835496&origin=inward"
  },
  "metadata": {
    "source": "scopus",
    "last_updated": "2026-05-06T15:53:47.077635",
    "data_quality_score": 90
  }
}
