{
  "publication_id": "2-s2.0-85086682999",
  "eid": "2-s2.0-85086682999",
  "doi": "10.1021/acsami.0c04806",
  "pii": null,
  "pubmed_id": "32441912",
  "title": "Role of Transition Metals on TM/Mo2C Composites: Hydrogen Evolution Activity in Mildly Acidic and Alkaline Media",
  "year": "2020",
  "date": "2020-06-17",
  "type": "article",
  "subtype": "ar",
  "journal": {
    "name": "ACS Applied Materials and Interfaces",
    "issn": "19448244",
    "eissn": "19448252",
    "volume": "12",
    "issue": "24",
    "pages": "27150-27165",
    "article_number": null
  },
  "authors": [
    {
      "name": "Koverga, Andrey A.",
      "scopus_id": "35422368900",
      "affiliation": null,
      "is_eam_professor": false,
      "eam_professor_id": null
    },
    {
      "name": "Gómez-Marín, Ana M.",
      "scopus_id": "36129399700",
      "affiliation": null,
      "is_eam_professor": true,
      "eam_professor_id": "ana-m-gomez-marin"
    },
    {
      "name": "Dorkis, Ludovic",
      "scopus_id": "57211536119",
      "affiliation": null,
      "is_eam_professor": false,
      "eam_professor_id": null
    },
    {
      "name": "Flórez, Elizabeth",
      "scopus_id": "12791301700",
      "affiliation": null,
      "is_eam_professor": false,
      "eam_professor_id": null
    },
    {
      "name": "Ticianelli, Edson A.",
      "scopus_id": "35444263400",
      "affiliation": null,
      "is_eam_professor": false,
      "eam_professor_id": null
    }
  ],
  "eam_coauthors": [
    "ana-m-gomez-marin"
  ],
  "scopus": {
    "citations": 29,
    "references_count": 77,
    "scopus_link": "https://www.scopus.com/inward/record.uri?partnerID=HzOxMe3b&scp=85086682999&origin=inward"
  },
  "metadata": {
    "source": "scopus",
    "last_updated": "2026-05-06T15:53:47.054048",
    "data_quality_score": 100
  }
}
