{
  "publication_id": "2-s2.0-105012092349",
  "eid": "2-s2.0-105012092349",
  "doi": "10.1109/CROS66186.2025.11066146",
  "pii": null,
  "pubmed_id": null,
  "title": "Protocol Performance in Robotics: Analyzing ADS vs. UDP Protocols for ROS2 and TwinCAT Integration",
  "year": "2025",
  "date": "2025-01-01",
  "type": "article",
  "subtype": "cp",
  "journal": {
    "name": "Proceedings 2025 1st Conference on Robotics Cros 2025",
    "issn": null,
    "eissn": null,
    "volume": null,
    "issue": null,
    "pages": null,
    "article_number": null
  },
  "authors": [
    {
      "name": "Domingues, Brenno",
      "scopus_id": "59362692800",
      "affiliation": null,
      "is_eam_professor": false,
      "eam_professor_id": null
    },
    {
      "name": "Costa, Thamiris Lima",
      "scopus_id": "57216688464",
      "affiliation": null,
      "is_eam_professor": false,
      "eam_professor_id": null
    },
    {
      "name": "Meireles, Marco",
      "scopus_id": "60021585000",
      "affiliation": null,
      "is_eam_professor": false,
      "eam_professor_id": null
    },
    {
      "name": "Becker, Lidomar",
      "scopus_id": "60021223200",
      "affiliation": null,
      "is_eam_professor": false,
      "eam_professor_id": null
    },
    {
      "name": "Greschuk, Jonas",
      "scopus_id": "60021400300",
      "affiliation": null,
      "is_eam_professor": false,
      "eam_professor_id": null
    },
    {
      "name": "De Souza, Diego",
      "scopus_id": "58669607900",
      "affiliation": null,
      "is_eam_professor": false,
      "eam_professor_id": null
    },
    {
      "name": "Secco, Ismael",
      "scopus_id": "58900083600",
      "affiliation": null,
      "is_eam_professor": false,
      "eam_professor_id": null
    },
    {
      "name": "Trabasso, Luis Gonzaga",
      "scopus_id": "6507256443",
      "affiliation": null,
      "is_eam_professor": true,
      "eam_professor_id": "luis-gonzaga-trabasso"
    }
  ],
  "eam_coauthors": [
    "luis-gonzaga-trabasso"
  ],
  "scopus": {
    "citations": 1,
    "references_count": 21,
    "scopus_link": "https://www.scopus.com/inward/record.uri?partnerID=HzOxMe3b&scp=105012092349&origin=inward"
  },
  "metadata": {
    "source": "scopus",
    "last_updated": "2026-05-06T15:53:47.124859",
    "data_quality_score": 100
  }
}
