{
  "publication_id": "2-s2.0-0033882874",
  "eid": "2-s2.0-0033882874",
  "doi": null,
  "pii": null,
  "pubmed_id": null,
  "title": "Optimization of dynamic vibration absorbers over a frequency band",
  "year": "2000",
  "date": "2000-01-01",
  "type": "article",
  "subtype": "ar",
  "journal": {
    "name": "Shock and Vibration Digest",
    "issn": "05831024",
    "eissn": null,
    "volume": "32",
    "issue": "1",
    "pages": "36",
    "article_number": null
  },
  "authors": [
    {
      "name": "Rade, D. A.",
      "scopus_id": "6701889091",
      "affiliation": null,
      "is_eam_professor": true,
      "eam_professor_id": "domingos-a-rade"
    },
    {
      "name": "Steffen, V.",
      "scopus_id": "7004361797",
      "affiliation": null,
      "is_eam_professor": false,
      "eam_professor_id": null
    }
  ],
  "eam_coauthors": [
    "domingos-a-rade"
  ],
  "scopus": {
    "citations": 0,
    "references_count": 0,
    "scopus_link": "https://www.scopus.com/inward/record.uri?partnerID=HzOxMe3b&scp=0033882874&origin=inward"
  },
  "metadata": {
    "source": "scopus",
    "last_updated": "2026-05-06T15:53:47.089683",
    "data_quality_score": 60
  }
}
