{
  "publication_id": "2-s2.0-79953656950",
  "eid": "2-s2.0-79953656950",
  "doi": "10.1063/1.3551724",
  "pii": null,
  "pubmed_id": null,
  "title": "Biparametric equilibria bifurcations of the Pierce diode: A one-dimensional plasma-filled device",
  "year": "2011",
  "date": "2011-03-01",
  "type": "article",
  "subtype": "ar",
  "journal": {
    "name": "Physics of Plasmas",
    "issn": "1070664X",
    "eissn": null,
    "volume": "18",
    "issue": "3",
    "pages": null,
    "article_number": "033105"
  },
  "authors": [
    {
      "name": "Terra, Maisa O.",
      "scopus_id": "7003287545",
      "affiliation": null,
      "is_eam_professor": true,
      "eam_professor_id": "maisa-de-oliveira-terra"
    }
  ],
  "eam_coauthors": [
    "maisa-de-oliveira-terra"
  ],
  "scopus": {
    "citations": 2,
    "references_count": 30,
    "scopus_link": "https://www.scopus.com/inward/record.uri?partnerID=HzOxMe3b&scp=79953656950&origin=inward"
  },
  "metadata": {
    "source": "scopus",
    "last_updated": "2026-05-06T15:53:47.068571",
    "data_quality_score": 90
  }
}
