{
  "publication_id": "2-s2.0-85086901922",
  "eid": "2-s2.0-85086901922",
  "doi": "10.1016/j.jece.2020.104128",
  "pii": "S2213343720304760",
  "pubmed_id": null,
  "title": "Physicochemical modifications of radioactive oil sludge by ozone treatment",
  "year": "2020",
  "date": "2020-01-01",
  "type": "article",
  "subtype": "ar",
  "journal": {
    "name": "Journal of Environmental Chemical Engineering",
    "issn": null,
    "eissn": "22133437",
    "volume": "8",
    "issue": "5",
    "pages": null,
    "article_number": "104128"
  },
  "authors": [
    {
      "name": "De Araujo, Leandro Goulart",
      "scopus_id": "57218798507",
      "affiliation": null,
      "is_eam_professor": false,
      "eam_professor_id": null
    },
    {
      "name": "Prado, Eduardo Sant Ana Petraconi",
      "scopus_id": "57212213467",
      "affiliation": null,
      "is_eam_professor": false,
      "eam_professor_id": null
    },
    {
      "name": "De Souza Miranda, Felipe",
      "scopus_id": "57190072146",
      "affiliation": null,
      "is_eam_professor": false,
      "eam_professor_id": null
    },
    {
      "name": "Vicente, Roberto",
      "scopus_id": "7005480213",
      "affiliation": null,
      "is_eam_professor": false,
      "eam_professor_id": null
    },
    {
      "name": "Da Silva Sobrinho, Argemiro Soares",
      "scopus_id": "6602001816",
      "affiliation": null,
      "is_eam_professor": true,
      "eam_professor_id": "argemiro-s-silva-sobrinho"
    },
    {
      "name": "Filho, Gilberto Petraconi",
      "scopus_id": "7801435334",
      "affiliation": null,
      "is_eam_professor": true,
      "eam_professor_id": "gilberto-petraconi-filho"
    },
    {
      "name": "Marumo, Júlio Takehiro",
      "scopus_id": "55675222183",
      "affiliation": null,
      "is_eam_professor": false,
      "eam_professor_id": null
    }
  ],
  "eam_coauthors": [
    "argemiro-s-silva-sobrinho",
    "gilberto-petraconi-filho"
  ],
  "scopus": {
    "citations": 13,
    "references_count": 47,
    "scopus_link": "https://www.scopus.com/inward/record.uri?partnerID=HzOxMe3b&scp=85086901922&origin=inward"
  },
  "metadata": {
    "source": "scopus",
    "last_updated": "2026-05-06T15:53:47.059164",
    "data_quality_score": 100
  }
}
