{
  "publication_id": "2-s2.0-21544459047",
  "eid": "2-s2.0-21544459047",
  "doi": "10.1115/ht-fed2004-56763",
  "pii": null,
  "pubmed_id": null,
  "title": "A model for turbulent kinetic energy distribution across the interface between a porous medium and an unobstructed region",
  "year": "2004",
  "date": "2004-01-01",
  "type": "article",
  "subtype": "cp",
  "journal": {
    "name": "Proceedings of the ASME Heat Transfer Fluids Engineering Summer Conference 2004 Ht FED 2004",
    "issn": null,
    "eissn": null,
    "volume": "1",
    "issue": null,
    "pages": "903-909",
    "article_number": "HT-FED04-56763"
  },
  "authors": [
    {
      "name": "De Lemos, Marcelo J.S.",
      "scopus_id": "7004984975",
      "affiliation": null,
      "is_eam_professor": true,
      "eam_professor_id": "marcelo-jose-s-de-lemos"
    }
  ],
  "eam_coauthors": [
    "marcelo-jose-s-de-lemos"
  ],
  "scopus": {
    "citations": 0,
    "references_count": 28,
    "scopus_link": "https://www.scopus.com/inward/record.uri?partnerID=HzOxMe3b&scp=21544459047&origin=inward"
  },
  "metadata": {
    "source": "scopus",
    "last_updated": "2026-05-06T15:53:47.111503",
    "data_quality_score": 80
  }
}
