{
  "publication_id": "2-s2.0-85092529373",
  "eid": "2-s2.0-85092529373",
  "doi": "10.1016/j.surfcoat.2020.126447",
  "pii": "S0257897220311166",
  "pubmed_id": null,
  "title": "High-velocity plasma spray process using hybrid SiO2 + ZrO2 precursor for deposition of environmental barrier coatings",
  "year": "2020",
  "date": "2020-12-25",
  "type": "article",
  "subtype": "ar",
  "journal": {
    "name": "Surface and Coatings Technology",
    "issn": "02578972",
    "eissn": null,
    "volume": "404",
    "issue": null,
    "pages": null,
    "article_number": "126447"
  },
  "authors": [
    {
      "name": "Miranda, F. S.",
      "scopus_id": "57190072146",
      "affiliation": null,
      "is_eam_professor": false,
      "eam_professor_id": null
    },
    {
      "name": "Caliari, F. R.",
      "scopus_id": "54926768900",
      "affiliation": null,
      "is_eam_professor": false,
      "eam_professor_id": null
    },
    {
      "name": "Campos, T. M.",
      "scopus_id": "25647296400",
      "affiliation": null,
      "is_eam_professor": false,
      "eam_professor_id": null
    },
    {
      "name": "Leite, D. M.G.",
      "scopus_id": "6603854648",
      "affiliation": null,
      "is_eam_professor": true,
      "eam_professor_id": "douglas-marcel-g-leite"
    },
    {
      "name": "Pessoa, R. S.",
      "scopus_id": "14042320200",
      "affiliation": null,
      "is_eam_professor": false,
      "eam_professor_id": null
    },
    {
      "name": "Essiptchouk, A. M.",
      "scopus_id": "6603457553",
      "affiliation": null,
      "is_eam_professor": false,
      "eam_professor_id": null
    },
    {
      "name": "Petraconi, G.",
      "scopus_id": "7801435334",
      "affiliation": null,
      "is_eam_professor": true,
      "eam_professor_id": "gilberto-petraconi-filho"
    }
  ],
  "eam_coauthors": [
    "douglas-marcel-g-leite",
    "gilberto-petraconi-filho"
  ],
  "scopus": {
    "citations": 11,
    "references_count": 40,
    "scopus_link": "https://www.scopus.com/inward/record.uri?partnerID=HzOxMe3b&scp=85092529373&origin=inward"
  },
  "metadata": {
    "source": "scopus",
    "last_updated": "2026-05-06T15:53:47.056651",
    "data_quality_score": 100
  }
}
