{
  "publication_id": "2-s2.0-85181932014",
  "eid": "2-s2.0-85181932014",
  "doi": "10.1016/j.geoen.2023.212620",
  "pii": "S2949891023012071",
  "pubmed_id": null,
  "title": "Experimental investigation of Al-Fe2O3 thermite reactions for thermal plug and abandonment of oil wells",
  "year": "2024",
  "date": "2024-03-01",
  "type": "article",
  "subtype": "ar",
  "journal": {
    "name": "Geoenergy Science and Engineering",
    "issn": null,
    "eissn": "29498910",
    "volume": "234",
    "issue": null,
    "pages": null,
    "article_number": "212620"
  },
  "authors": [
    {
      "name": "De Souza, Kesiany M.",
      "scopus_id": "57214792234",
      "affiliation": null,
      "is_eam_professor": false,
      "eam_professor_id": null
    },
    {
      "name": "de Lemos, Marcelo J.S.",
      "scopus_id": "7004984975",
      "affiliation": null,
      "is_eam_professor": true,
      "eam_professor_id": "marcelo-jose-s-de-lemos"
    },
    {
      "name": "Ribeiro, Roberta dos R.",
      "scopus_id": "57206127272",
      "affiliation": null,
      "is_eam_professor": false,
      "eam_professor_id": null
    },
    {
      "name": "Marin, Ana M.G.",
      "scopus_id": "57613888500",
      "affiliation": null,
      "is_eam_professor": false,
      "eam_professor_id": null
    },
    {
      "name": "Martins, Paulo G.C.",
      "scopus_id": "58804810600",
      "affiliation": null,
      "is_eam_professor": false,
      "eam_professor_id": null
    },
    {
      "name": "Gouvêa, Leonardo H.",
      "scopus_id": "56083666800",
      "affiliation": null,
      "is_eam_professor": false,
      "eam_professor_id": null
    }
  ],
  "eam_coauthors": [
    "marcelo-jose-s-de-lemos"
  ],
  "scopus": {
    "citations": 10,
    "references_count": 57,
    "scopus_link": "https://www.scopus.com/inward/record.uri?partnerID=HzOxMe3b&scp=85181932014&origin=inward"
  },
  "metadata": {
    "source": "scopus",
    "last_updated": "2026-05-06T15:53:47.110185",
    "data_quality_score": 100
  }
}
