{
  "publication_id": "2-s2.0-85076250374",
  "eid": "2-s2.0-85076250374",
  "doi": "10.1016/j.ijheatmasstransfer.2019.119128",
  "pii": "S0017931019345545",
  "pubmed_id": null,
  "title": "Transient behavior and thermal efficiency of volumetric heat receivers",
  "year": "2020",
  "date": "2020-03-01",
  "type": "article",
  "subtype": "ar",
  "journal": {
    "name": "International Journal of Heat and Mass Transfer",
    "issn": "00179310",
    "eissn": null,
    "volume": "149",
    "issue": null,
    "pages": null,
    "article_number": "119128"
  },
  "authors": [
    {
      "name": "Ribeiro, Roberta R.",
      "scopus_id": "57206127272",
      "affiliation": null,
      "is_eam_professor": false,
      "eam_professor_id": null
    },
    {
      "name": "de Lemos, Marcelo J.S.",
      "scopus_id": "7004984975",
      "affiliation": null,
      "is_eam_professor": true,
      "eam_professor_id": "marcelo-jose-s-de-lemos"
    }
  ],
  "eam_coauthors": [
    "marcelo-jose-s-de-lemos"
  ],
  "scopus": {
    "citations": 11,
    "references_count": 51,
    "scopus_link": "https://www.scopus.com/inward/record.uri?partnerID=HzOxMe3b&scp=85076250374&origin=inward"
  },
  "metadata": {
    "source": "scopus",
    "last_updated": "2026-05-06T15:53:47.110421",
    "data_quality_score": 100
  }
}
