{
  "publication_id": "2-s2.0-0141822863",
  "eid": "2-s2.0-0141822863",
  "doi": "10.1080/10407780307351",
  "pii": null,
  "pubmed_id": null,
  "title": "Numerical analysis of the stress jump interface condition for laminar flow over a porous layer",
  "year": "2003",
  "date": "2003-05-02",
  "type": "article",
  "subtype": "ar",
  "journal": {
    "name": "Numerical Heat Transfer Part A Applications",
    "issn": "10407782",
    "eissn": null,
    "volume": "43",
    "issue": "6",
    "pages": "603-617",
    "article_number": null
  },
  "authors": [
    {
      "name": "Silva, Renato A.",
      "scopus_id": "35578549800",
      "affiliation": null,
      "is_eam_professor": false,
      "eam_professor_id": null
    },
    {
      "name": "De Lemos, Marcelo J.S.",
      "scopus_id": "7004984975",
      "affiliation": null,
      "is_eam_professor": true,
      "eam_professor_id": "marcelo-jose-s-de-lemos"
    }
  ],
  "eam_coauthors": [
    "marcelo-jose-s-de-lemos"
  ],
  "scopus": {
    "citations": 77,
    "references_count": 25,
    "scopus_link": "https://www.scopus.com/inward/record.uri?partnerID=HzOxMe3b&scp=0141822863&origin=inward"
  },
  "metadata": {
    "source": "scopus",
    "last_updated": "2026-05-06T15:53:47.111575",
    "data_quality_score": 90
  }
}
