{
  "publication_id": "2-s2.0-84891841742",
  "eid": "2-s2.0-84891841742",
  "doi": "10.1007/s40430-013-0057-3",
  "pii": null,
  "pubmed_id": null,
  "title": "Verification and accuracy comparison of commercial CFD codes using hydrodynamic instability",
  "year": "2014",
  "date": "2014-01-01",
  "type": "article",
  "subtype": "ar",
  "journal": {
    "name": "Journal of the Brazilian Society of Mechanical Sciences and Engineering",
    "issn": "16785878",
    "eissn": "18063691",
    "volume": "36",
    "issue": "1",
    "pages": "59-68",
    "article_number": null
  },
  "authors": [
    {
      "name": "Gennaro, Elmer M.",
      "scopus_id": "55544828400",
      "affiliation": null,
      "is_eam_professor": false,
      "eam_professor_id": null
    },
    {
      "name": "Simões, Leandro G.C.",
      "scopus_id": "36652031100",
      "affiliation": null,
      "is_eam_professor": false,
      "eam_professor_id": null
    },
    {
      "name": "Malatesta, Vinicius",
      "scopus_id": "55789261500",
      "affiliation": null,
      "is_eam_professor": true,
      "eam_professor_id": "vinicius-malatesta"
    },
    {
      "name": "Reis, Danilo C.",
      "scopus_id": "57189455726",
      "affiliation": null,
      "is_eam_professor": false,
      "eam_professor_id": null
    },
    {
      "name": "Medeiros, Marcello A.F.",
      "scopus_id": "25028151200",
      "affiliation": null,
      "is_eam_professor": false,
      "eam_professor_id": null
    }
  ],
  "eam_coauthors": [
    "vinicius-malatesta"
  ],
  "scopus": {
    "citations": 1,
    "references_count": 32,
    "scopus_link": "https://www.scopus.com/inward/record.uri?partnerID=HzOxMe3b&scp=84891841742&origin=inward"
  },
  "metadata": {
    "source": "scopus",
    "last_updated": "2026-05-06T15:53:47.073151",
    "data_quality_score": 100
  }
}
