{
  "publication_id": "2-s2.0-85166750348",
  "eid": "2-s2.0-85166750348",
  "doi": "10.1103/PhysRevFluids.8.074606",
  "pii": null,
  "pubmed_id": null,
  "title": "Large-eddy-simulation-informed resolvent-based estimation of turbulent pipe flow",
  "year": "2023",
  "date": "2023-07-01",
  "type": "article",
  "subtype": "ar",
  "journal": {
    "name": "Physical Review Fluids",
    "issn": null,
    "eissn": "2469990X",
    "volume": "8",
    "issue": "7",
    "pages": null,
    "article_number": "074606"
  },
  "authors": [
    {
      "name": "Do Amaral, Filipe R.",
      "scopus_id": "57188717193",
      "affiliation": null,
      "is_eam_professor": false,
      "eam_professor_id": null
    },
    {
      "name": "Cavalieri, André V.G.",
      "scopus_id": "22949935300",
      "affiliation": null,
      "is_eam_professor": true,
      "eam_professor_id": "andre-v-g-cavalieri"
    }
  ],
  "eam_coauthors": [
    "andre-v-g-cavalieri"
  ],
  "scopus": {
    "citations": 1,
    "references_count": 51,
    "scopus_link": "https://www.scopus.com/inward/record.uri?partnerID=HzOxMe3b&scp=85166750348&origin=inward"
  },
  "metadata": {
    "source": "scopus",
    "last_updated": "2026-05-06T15:53:47.100423",
    "data_quality_score": 90
  }
}
