{
  "publication_id": "2-s2.0-84940121684",
  "eid": "2-s2.0-84940121684",
  "doi": "10.1155/2015/729684",
  "pii": null,
  "pubmed_id": null,
  "title": "Experimental nondestructive test for estimation of buckling load on unstiffened cylindrical shells using vibration correlation technique",
  "year": "2015",
  "date": "2015-01-01",
  "type": "article",
  "subtype": "ar",
  "journal": {
    "name": "Shock and Vibration",
    "issn": "10709622",
    "eissn": null,
    "volume": "2015",
    "issue": null,
    "pages": null,
    "article_number": "729684"
  },
  "authors": [
    {
      "name": "Kalnins, Kaspars",
      "scopus_id": "12142723900",
      "affiliation": null,
      "is_eam_professor": false,
      "eam_professor_id": null
    },
    {
      "name": "Arbelo, Mariano A.",
      "scopus_id": "57211220623",
      "affiliation": null,
      "is_eam_professor": true,
      "eam_professor_id": "mariano-andres-arbelo"
    },
    {
      "name": "Ozolins, Olgerts",
      "scopus_id": "55486832800",
      "affiliation": null,
      "is_eam_professor": false,
      "eam_professor_id": null
    },
    {
      "name": "Skukis, Eduards",
      "scopus_id": "34868924900",
      "affiliation": null,
      "is_eam_professor": false,
      "eam_professor_id": null
    },
    {
      "name": "Castro, Saullo G.P.",
      "scopus_id": "55796884200",
      "affiliation": null,
      "is_eam_professor": false,
      "eam_professor_id": null
    },
    {
      "name": "Degenhardt, Richard",
      "scopus_id": "12144431600",
      "affiliation": null,
      "is_eam_professor": false,
      "eam_professor_id": null
    }
  ],
  "eam_coauthors": [
    "mariano-andres-arbelo"
  ],
  "scopus": {
    "citations": 45,
    "references_count": 20,
    "scopus_link": "https://www.scopus.com/inward/record.uri?partnerID=HzOxMe3b&scp=84940121684&origin=inward"
  },
  "metadata": {
    "source": "scopus",
    "last_updated": "2026-05-06T15:53:47.074491",
    "data_quality_score": 90
  }
}
