{
  "publication_id": "2-s2.0-105005933872",
  "eid": "2-s2.0-105005933872",
  "doi": "10.1615/TFEC2025.cmd.055882",
  "pii": null,
  "pubmed_id": null,
  "title": "A COUPLED BOUNDARY CONDITION FOR THERMAL-FLUID CONJUGATE HEAT TRANSFER ANALYSIS",
  "year": "2025",
  "date": "2025-01-01",
  "type": "article",
  "subtype": "cp",
  "journal": {
    "name": "Proceedings of the Thermal and Fluids Engineering Summer Conference",
    "issn": null,
    "eissn": "23791748",
    "volume": null,
    "issue": null,
    "pages": "169-178",
    "article_number": null
  },
  "authors": [
    {
      "name": "Botezelli, Daniel",
      "scopus_id": "59145523600",
      "affiliation": null,
      "is_eam_professor": false,
      "eam_professor_id": null
    },
    {
      "name": "de Azevedo, Arthur Mendonca",
      "scopus_id": "57549901500",
      "affiliation": null,
      "is_eam_professor": false,
      "eam_professor_id": null
    },
    {
      "name": "Dos Santos Magalhães, Elisan",
      "scopus_id": "56673863600",
      "affiliation": null,
      "is_eam_professor": true,
      "eam_professor_id": "elisan-dos-santos-magalhaes"
    },
    {
      "name": "Kassab, Alain J.",
      "scopus_id": "7006847384",
      "affiliation": null,
      "is_eam_professor": false,
      "eam_professor_id": null
    },
    {
      "name": "Malalasekara, Weeratunge",
      "scopus_id": "58795886000",
      "affiliation": null,
      "is_eam_professor": false,
      "eam_professor_id": null
    }
  ],
  "eam_coauthors": [
    "elisan-dos-santos-magalhaes"
  ],
  "scopus": {
    "citations": 0,
    "references_count": 13,
    "scopus_link": "https://www.scopus.com/inward/record.uri?partnerID=HzOxMe3b&scp=105005933872&origin=inward"
  },
  "metadata": {
    "source": "scopus",
    "last_updated": "2026-05-06T15:53:47.090891",
    "data_quality_score": 90
  }
}
