{
  "publication_id": "2-s2.0-84918815550",
  "eid": "2-s2.0-84918815550",
  "doi": "10.1016/j.euromechflu.2014.03.004",
  "pii": "S0997754614000399",
  "pubmed_id": null,
  "title": "A study of linear wavepacket models for subsonic turbulent jets using local eigenmode decomposition of PIV data",
  "year": "2015",
  "date": "2015-01-01",
  "type": "article",
  "subtype": "ar",
  "journal": {
    "name": "European Journal of Mechanics B Fluids",
    "issn": "09977546",
    "eissn": null,
    "volume": "49",
    "issue": "PB",
    "pages": "308-321",
    "article_number": null
  },
  "authors": [
    {
      "name": "Rodríguez, Daniel",
      "scopus_id": "55255594800",
      "affiliation": null,
      "is_eam_professor": false,
      "eam_professor_id": null
    },
    {
      "name": "Cavalieri, André V.G.",
      "scopus_id": "22949935300",
      "affiliation": null,
      "is_eam_professor": true,
      "eam_professor_id": "andre-v-g-cavalieri"
    },
    {
      "name": "Colonius, Tim",
      "scopus_id": "7004086046",
      "affiliation": null,
      "is_eam_professor": false,
      "eam_professor_id": null
    },
    {
      "name": "Jordan, Peter",
      "scopus_id": "24759157900",
      "affiliation": null,
      "is_eam_professor": false,
      "eam_professor_id": null
    }
  ],
  "eam_coauthors": [
    "andre-v-g-cavalieri"
  ],
  "scopus": {
    "citations": 48,
    "references_count": 51,
    "scopus_link": "https://www.scopus.com/inward/record.uri?partnerID=HzOxMe3b&scp=84918815550&origin=inward"
  },
  "metadata": {
    "source": "scopus",
    "last_updated": "2026-05-06T15:53:47.101956",
    "data_quality_score": 100
  }
}
