{
  "publication_id": "2-s2.0-85044956786",
  "eid": "2-s2.0-85044956786",
  "doi": "10.1016/j.ymssp.2018.03.049",
  "pii": "S0888327018301766",
  "pubmed_id": null,
  "title": "Nonparametric probabilistic approach of uncertainties with correlated mass and stiffness random matrices",
  "year": "2018",
  "date": "2018-10-01",
  "type": "article",
  "subtype": "ar",
  "journal": {
    "name": "Mechanical Systems and Signal Processing",
    "issn": "08883270",
    "eissn": "10961216",
    "volume": "111",
    "issue": null,
    "pages": "102-112",
    "article_number": null
  },
  "authors": [
    {
      "name": "Batou, Anas",
      "scopus_id": "24502644700",
      "affiliation": null,
      "is_eam_professor": false,
      "eam_professor_id": null
    },
    {
      "name": "Nabarrete, Airton",
      "scopus_id": "6508307482",
      "affiliation": null,
      "is_eam_professor": true,
      "eam_professor_id": "airton-nabarrete"
    }
  ],
  "eam_coauthors": [
    "airton-nabarrete"
  ],
  "scopus": {
    "citations": 7,
    "references_count": 15,
    "scopus_link": "https://www.scopus.com/inward/record.uri?partnerID=HzOxMe3b&scp=85044956786&origin=inward"
  },
  "metadata": {
    "source": "scopus",
    "last_updated": "2026-05-06T15:53:47.123233",
    "data_quality_score": 100
  }
}
