{
  "publication_id": "2-s2.0-85130272436",
  "eid": "2-s2.0-85130272436",
  "doi": "10.1007/s40430-022-03540-9",
  "pii": null,
  "pubmed_id": null,
  "title": "Three-dimensional flow investigation of a high-pressure turbine with rotor tip desensitization based on Winglet geometry",
  "year": "2022",
  "date": "2022-06-01",
  "type": "article",
  "subtype": "ar",
  "journal": {
    "name": "Journal of the Brazilian Society of Mechanical Sciences and Engineering",
    "issn": "16785878",
    "eissn": "18063691",
    "volume": "44",
    "issue": "6",
    "pages": null,
    "article_number": "239"
  },
  "authors": [
    {
      "name": "Maia, Ana A.G.",
      "scopus_id": "57216152270",
      "affiliation": null,
      "is_eam_professor": false,
      "eam_professor_id": null
    },
    {
      "name": "Silva, Lucilene M.",
      "scopus_id": "57697692700",
      "affiliation": null,
      "is_eam_professor": false,
      "eam_professor_id": null
    },
    {
      "name": "Tomita, Jesuíno T.",
      "scopus_id": "15058420800",
      "affiliation": null,
      "is_eam_professor": true,
      "eam_professor_id": "jesuino-takachi-tomita"
    },
    {
      "name": "Bringhenti, Cleverson",
      "scopus_id": "7801357927",
      "affiliation": null,
      "is_eam_professor": true,
      "eam_professor_id": "cleverson-bringhenti"
    }
  ],
  "eam_coauthors": [
    "jesuino-takachi-tomita",
    "cleverson-bringhenti"
  ],
  "scopus": {
    "citations": 2,
    "references_count": 56,
    "scopus_link": "https://www.scopus.com/inward/record.uri?partnerID=HzOxMe3b&scp=85130272436&origin=inward"
  },
  "metadata": {
    "source": "scopus",
    "last_updated": "2026-05-06T15:53:47.051629",
    "data_quality_score": 100
  }
}
