{
  "publication_id": "2-s2.0-84879886784",
  "eid": "2-s2.0-84879886784",
  "doi": "10.1007/s10934-012-9635-5",
  "pii": null,
  "pubmed_id": null,
  "title": "Activated carbon derived from macadamia nut shells: An effective adsorbent for phenol removal",
  "year": "2013",
  "date": "2013-08-01",
  "type": "article",
  "subtype": "ar",
  "journal": {
    "name": "Journal of Porous Materials",
    "issn": "13802224",
    "eissn": null,
    "volume": "20",
    "issue": "4",
    "pages": "619-627",
    "article_number": null
  },
  "authors": [
    {
      "name": "Rodrigues, Liana Alvares",
      "scopus_id": "13205134800",
      "affiliation": null,
      "is_eam_professor": false,
      "eam_professor_id": null
    },
    {
      "name": "De Sousa Ribeiro, Loriane Aparecida",
      "scopus_id": "55370121700",
      "affiliation": null,
      "is_eam_professor": false,
      "eam_professor_id": null
    },
    {
      "name": "Thim, Gilmar Patrocínio",
      "scopus_id": "6602627592",
      "affiliation": null,
      "is_eam_professor": true,
      "eam_professor_id": "gilmar-patrocinio-thim"
    },
    {
      "name": "Ferreira, Rafael Reinaldo",
      "scopus_id": "56370660400",
      "affiliation": null,
      "is_eam_professor": false,
      "eam_professor_id": null
    },
    {
      "name": "Alvarez-Mendez, Manoel Orlando",
      "scopus_id": "15048244200",
      "affiliation": null,
      "is_eam_professor": false,
      "eam_professor_id": null
    },
    {
      "name": "Coutinho, Aparecido Dos Reis",
      "scopus_id": "57033658800",
      "affiliation": null,
      "is_eam_professor": false,
      "eam_professor_id": null
    }
  ],
  "eam_coauthors": [
    "gilmar-patrocinio-thim"
  ],
  "scopus": {
    "citations": 53,
    "references_count": 37,
    "scopus_link": "https://www.scopus.com/inward/record.uri?partnerID=HzOxMe3b&scp=84879886784&origin=inward"
  },
  "metadata": {
    "source": "scopus",
    "last_updated": "2026-05-06T15:53:47.106410",
    "data_quality_score": 100
  }
}
