{
  "publication_id": "2-s2.0-33947170699",
  "eid": "2-s2.0-33947170699",
  "doi": null,
  "pii": null,
  "pubmed_id": null,
  "title": "Fish alert",
  "year": "2007",
  "date": "2007-01-01",
  "type": "article",
  "subtype": "re",
  "journal": {
    "name": "Metalurgia E Materiais",
    "issn": "01040898",
    "eissn": null,
    "volume": "63",
    "issue": "574",
    "pages": "14-20",
    "article_number": null
  },
  "authors": [
    {
      "name": "Jockymaan, André",
      "scopus_id": "16038981600",
      "affiliation": null,
      "is_eam_professor": false,
      "eam_professor_id": null
    },
    {
      "name": "Silva, Maroni",
      "scopus_id": "55467620200",
      "affiliation": null,
      "is_eam_professor": true,
      "eam_professor_id": "maria-margareth-da-silva"
    }
  ],
  "eam_coauthors": [
    "maria-margareth-da-silva"
  ],
  "scopus": {
    "citations": 0,
    "references_count": 0,
    "scopus_link": "https://www.scopus.com/inward/record.uri?partnerID=HzOxMe3b&scp=33947170699&origin=inward"
  },
  "metadata": {
    "source": "scopus",
    "last_updated": "2026-05-06T15:53:47.092423",
    "data_quality_score": 40
  }
}
